<?xml version="1.0" encoding="UTF-8"?>
<xsd:schema xmlns="http://www.inteco.es/xbrl/lenlocpenloc2010/identifiers" xmlns:xsd="http://www.w3.org/2001/XMLSchema" targetNamespace="http://www.inteco.es/xbrl/lenlocpenloc2010/identifiers" elementFormDefault="qualified" attributeFormDefault="unqualified">
	<xsd:import namespace="http://www.w3.org/XML/1998/namespace" schemaLocation="http://www.w3.org/2005/08/xml.xsd"/>
	<xsd:element name="global">
		<xsd:complexType>
			<xsd:sequence>
				<xsd:element name="configReport" maxOccurs="unbounded">
					<xsd:complexType>
						<xsd:sequence>
							<xsd:element name="nsItem" maxOccurs="unbounded">
								<xsd:complexType>
									<xsd:attribute name="prefix" type="xsd:string"/>
									<xsd:attribute name="uri" type="xsd:anyURI"/>
								</xsd:complexType>
							</xsd:element>
							<xsd:element name="unit" maxOccurs="unbounded">
								<xsd:complexType>
									<xsd:attribute name="key" type="xsd:string"/>
									<xsd:attribute name="code" type="xsd:string"/>
									<xsd:attribute name="prefix" type="xsd:string"/>
								</xsd:complexType>
							</xsd:element>
							<xsd:element name="schemaRef">
								<xsd:complexType>
									<xsd:attribute name="uri" type="xsd:anyURI"/>
									<xsd:attribute name="baseUrl" type="xsd:anyURI"/>
									<xsd:attribute name="main" type="xsd:boolean"/>
									<xsd:attribute name="type" type="xsd:string"/>
									<xsd:attribute name="targetNamespace" type="xsd:anyURI"/>
								</xsd:complexType>
							</xsd:element>
							<xsd:element name="configModule" maxOccurs="unbounded">
								<xsd:complexType>
									<xsd:sequence>
										<xsd:element name="definitionRoles" minOccurs="0">
											<xsd:complexType>
												<xsd:sequence>
													<xsd:element name="role" maxOccurs="unbounded">
														<xsd:complexType>
															<xsd:attribute name="uri" type="xsd:anyURI"/>
														</xsd:complexType>
													</xsd:element>
												</xsd:sequence>
											</xsd:complexType>
										</xsd:element>
										<xsd:element name="labelTypeRoles" minOccurs="0">
											<xsd:complexType>
												<xsd:sequence>
													<xsd:element name="role" maxOccurs="unbounded">
														<xsd:complexType>
															<xsd:attribute name="uri" type="xsd:anyURI"/>
														</xsd:complexType>
													</xsd:element>
												</xsd:sequence>
											</xsd:complexType>
										</xsd:element>
										<xsd:element name="file" maxOccurs="unbounded">
											<xsd:complexType>
												<xsd:attribute name="uri" type="xsd:anyURI"/>
												<xsd:attribute name="type" type="xsd:string"/>
											</xsd:complexType>
										</xsd:element>
									</xsd:sequence>
									<xsd:attribute name="presentationRole" type="xsd:string"/>
									<xsd:attribute name="labelRole" type="xsd:string"/>
									<xsd:attribute name="definitionRole" type="xsd:string"/>
									<xsd:attribute name="title" type="xsd:string"/>
									<xsd:attribute name="id" type="xsd:string"/>
									<xsd:attribute name="fileMap" type="xsd:string"/>
									<xsd:attribute name="tuple" type="xsd:boolean" use="optional"/>
								</xsd:complexType>
							</xsd:element>
						</xsd:sequence>
						<xsd:attribute name="id" type="xsd:string"/>
					</xsd:complexType>
				</xsd:element>
			</xsd:sequence>
			<xsd:attribute ref="xml:base"/>
		</xsd:complexType>
	</xsd:element>
</xsd:schema>
